,title,Background,Methods,Results,Conclusion
0,Genetic susceptibility to antibody-mediated arthritis,"The K/BxN model of murine inflammatory arthritis has provided exciting insights into this rheumatoid-like disease. The model emerged serendipitously from the intercross of T-cell receptor (TCR) transgenic mice x nonobese diabetic (NOD) mice (See Additional information [1]). Erosive arthritis occurred spontaneously in all the offspring. Arthritis was found to be intiated following recognition by the transgenic TCR of a glucose-6-phosphate isomerase (GPI) peptide, presented by the NOD class II molecule, I-Ag7. Transfer of serum from arthritic mice, containing anti-GPI antibodies was shown to induce arthritis in recipients, even if they were devoid of T and B cells. This paper explores the genetic basis for the variable susceptibility of different strains of inbred mice to serum-mediated arthritis.","Transfer of serum from arthritic K/BxN mice produced four categories of response in different inbred mouse strains: rapid and severe joint inflammation (Balb/c), slower and less severe (B6, DBA/1, CBA), slow and low-grade (SJL, 129/Sv), resistant (NOD, NZB, DBA/2). The crossing of strains with different susceptibilities indicated that the interaction of several genes was responsible for this effect.In (B6 x NOD)F2 mice, homozygosity for the NOD-derived C5 allele (n/n) conferred resistance to arthritis transfer. Homozygotes for the B6-derived C5 allele (b/b) showed more severe disease than heterozyogotes (b/n). A genome screen was applied to 132 susceptible F2 mice with either b/b or b/n C5 genotypes. Two major qualitative trait loci were identified, one corresponding to the C5 locus on chromosome 2 and the second, on chromosome 1, close to the locus encoding the Fc?RII. Further studies using fcgr2 deficient mice and B6 mice congenic for the NOD fcgr2 allele failed to substantiate a role for this locus in conferring susceptibility to arthritis transfer.","Inflammatory arthritis is the culmination of several steps in the immune cascade. This study facilitates the identification of genetic influences on this process by utilising inbred mouse strains and by isolating a late step in the development of arthrits, distal to the influence T- and B-cell function. Two major quantitative trait loci are identified and strong evidence implicating the complement C5 locus is presented. The similarity between evidence accruing for the role of immune complexes in arthritis in this model and collagen-induced arthritis is striking (see Additional information [2]).Further work is required to map the allele(s) responsible for the second quantitative trait locus defined and to determine whether the weaker linkages identified are real. These data will prompt functional studies concerning the role of C5 in early synovial inflammatory events and will restimulate interest in complement components as therapeutic targets in rheumatoid arthritis.","Arthritis induction by serum transfer from arthritic K/BxN mice to a panel of inbred strains, PCR -based genotyping of loci, Genetic mapping of quantitative trait loci"
1,Genetic variability of Hepatitis B virus in Morocco,"Morocco is a medium-level epidemic country for Hepatitis B Virus (HBV). However, little is known about clinical, virologic and phylogenetic features of HBV infection. The aim of the present study is to determine the HBV genetic variability, and its association with clinical outcome and severity of disease in Moroccan HBV carriers.","The study included 250 chronic HBV infection patients at different stages of liver disease (156 male and 94 female). Serum samples were tested for serological markers and HBV DNA levels. The HBV Surface and core promoter/precore regions were amplified and directly sequenced. The clinical, virologic and phylogenetic characteristics were investigated.","The mean age of patients was 44 ± 12.2. Most of them were HBeAg negative (90%). The mean HBV DNA was 475104 ± 160591 UI/mL. Phylogenetic analysis identified 90% isolates in genotype D and 10% in genotype A. Most genotypes D isolates belonged to subgenotype D7 (80%) followed by subgenotype D1 (25%) and one isolate belonged to subgenotype D2. All genotype A strains belonged to subgenotype A2 and specified subtype adw2. In genotypes D strains, subtypes ayw2 (91.7%), ayw3 (3.3%) and ayw4 (3.3%) were identified. A significance prevalence of mutations in the Major Hydrophilic Region (MHR) of HBsAg was found with P120T/S the most frequent. In the core promoter region, the most frequent mutations are G1757A (48.9%), T1773C (42.8%), C1766GÂ /T (40.8%), T1753V (30.7%) and A1762T/G1764A (24.4%). In the precore region, the most common mutations are G1896A (55.1%) and G1899A (34.6%). Double mutation in the core promoter A1762T/G1764A was found more frequently in HCC patients than that in non HCC patients (66.6 % vs 16.2%; p<0.001). In addition, the prevalence of C1653T, T1753V, and G1862T mutations was significantly higher in HCC patients compared with non HCC. However, the prevalence of the G1896A precore mutation was not different between patients with HCC and HBV carriers without HCC (55.5% vs 55%; p>0.05).",We described for the first time that Subgenotype D7/ayw2 is the most predominant in Morocco. The high frequency of mutations in the core promoter in patients with HCC indicates their association with severity of infection.
2,"Phenylketonuria - genetic, clinical and therapeutic aspects","Phenylketonuria (PKU) is an autosomal recessive inborn error of phenylalanine (Phe) metabolism caused by mutations in phenylalanine hydroxylase (PAH) gene. It is one of the most prevalent metabolic disorders, with a high frequency (around 1/10,000) among Caucasians.","The normal route for Phe metabolism is its hydroxylation to tyrosine, catalyzed by PAH and requiring tetrahydrobiopterin as a cofactor. The human PAH gene is located on chromosome 12q23.2 and contains 13 exons. More than 500 disease-causing mutations have been identified in patients with PKU or hyperphenylalaninaemia (HPA), 67% of them being missense mutations. Most of them result in severe enzyme deficiency generating the PKU phenotype, but some are associated with a ”non-PKU HPA” phenotype. Since the PAH gene is biallelic, most patients are compound heterozygotes.","Untreated PKU is associated with an abnormal phenotype including growth failure, microcephaly, seizures and intellectual impairment. The pathogenesis of these abnormalities involves the neurotoxic effects of hyperphenylalaninaemia, which are linked to Tyr deficiency (leading to a decrease in catecholamine neurotransmitters), the effect of elevated Phe concentrations on transport of other aminoacids across the blood brain barrier, accumulation of toxic by-products of Phe metabolism. Magnetic resonance imaging (MRI) has revealed white matter lesions in the brain of adult PKU patients, including hypomyelination and demyelination.","Newborn screening programs exist in many countries, based on the detection of a high blood Phe concentration. Conventional PKU diagnosis is based on the aberrant metabolic phenotype and the detection of disease causing mutations at the PAH locus. Available methods include Southern blotting, restriction enzyme digestion, gene sequencing. PKU mutation analysis is particularly useful in the detection of carriers, for prenatal diagnosis."
3,"Roles of the HUWE1 ubiquitin ligase in nervous system development, function and disease","HECT, UBA and WWE domain containing protein 1 (Huwe1) is an E3 ubiquitin ligase that is highly conserved across the animal kingdom [1,2,3,4] (Fig. 1a). While rodent, zebrafish and fly orthologs are also generally referred to as Huwe1, the C. elegans ortholog is called Enhancer of EFL-1 (EEL-1) based on its discovery in genetic screens. Early studies found that Huwe1 was involved in regulating tumor cell proliferation/suppression, apoptosis, responses to DNA damage and embryogenesis [2,3,4,5,6,7,8]. Many of these initial studies refer to Huwe1 by other names including Mule, ArfBP1, Lasu1, HectH9 or Ureb1. More recently, Huwe1 was shown to have important roles in the immune system and myogenesis [9,10,11].
Fig. 1HUWE1 is evolutionarily conserved and broadly expressed in animal nervous systems. a Domain architecture of Huwe1 orthologs from Homo sapiens (Hs), Mus musculus (Mm), Danio rerio (Dr), Drosophila melanogaster (Dm) and Caenorhabditis elegans (Ce). b In situ hybridization of Huwe1 in mouse brain. Note Huwe1 is expressed throughout the brain with high expression in olfactory bulb (OB), cerebral cortex (CTX), hippocampus (HP) and cerebellum (CB). ceel-1 promoter driving GFP expression in C. elegans. eel-1 is widely expressed in the nerve ring and head neurons (left), and ventral nerve cord (right; bars = nerve cord; arrows = motor neuron cell bodies). Schematic denotes locations of images shown and axon bundles of the nerve ring and ventral nerve cord. DUF = conserved Domain of Unknown Function, UBA = Ubiquitin Associated domain, WWE = domain with conserved tryptophan (W) and glutamate (E) residues, UBM = Ubiquitin-Binding Motif (previously known as DUF4414), HECT = Homologous to the E6-AP Carboxyl Terminus (HECT)-type E3 ubiquitin ligase domain. For B, image credit: Allen Institute© 2007 Allen Institute for Brain Science. Allen Mouse Brain Atlas. Available from: https://mouse.brain-map.org/experiment/show/70445293. For C, images reprinted from Cell Reports, Vol. 19, Opperman, Mulcahy, Giles, Risley, Birnbaum, Tulgren, Dawson-Scully, Zhen, Grill, The HECT Family Ubiquitin Ligase EEL-1 Regulates Neuronal Function and Development, 822–835, Copyright 2017, with permission from ElsevierFull size imageA growing body of work over the last 10 years, spanning multiple model systems, has shown that Huwe1 is important in nervous system development and function. Extensive human genetic studies have provided compelling evidence implicating Huwe1 in multiple neurodevelopmental disorders, including both non-syndromic and syndromic forms of X-linked intellectual disability (ID). In this review, we discuss how Huwe1 contributes to nervous system development, function and disease. We hope that exploring this literature encourages further studies on Huwe1 in the nervous system, and highlights valuable directions for future investigation from both a basic science and disease perspective.","Huwe1 is a ubiquitin ligase in the HECT family, a group of E3 ubiquitin ligases that function as single subunit enzymes [5, 12]. A striking feature of Huwe1 is its enormous size — well over 4000 amino acids (Fig. 1a). Huwe1 has numerous protein domains including a catalytic ubiquitin ligase domain, several domains involved in ubiquitin binding, and multiple conserved domains of unknown function (Fig. 1a and Fig. 4). The best characterized domain is the HECT domain, which is located at the C-terminus and is the catalytic E3 ubiquitin ligase domain that conjugates ubiquitin to substrates [13, 14]. Other domains involved in ubiquitination include a UBA domain that binds polyubiquitin chains, a WWE domain that mediates protein-protein interactions during ubiquitination, and a ubiquitin binding motif (UBM) that contains several repeated sequences and binds ubiquitin (previously called DUF4414). There is also an extremely small Bcl-2 homology domain 3 (BH3) that is a protein-protein interaction region, and only present in vertebrate isoforms of Huwe1. Two studies have solved the structure of the HECT domain [13, 14]. Interestingly, the Huwe1 HECT domain forms a dimer, which leads to autoinhibition of catalytic ubiquitin ligase activity [14]. At present, the functional roles of many domains in Huwe1 remain unknown, and the biochemical mechanisms that allow for substrate specificity are unclear. The full complement of proteins that interact with Huwe1 and potential non-ubiquitin ligase mechanisms of Huwe1 function also remain largely unexplored.Interest in Huwe1 function in the nervous system becomes apparent when one simply considers how broadly expressed this molecule is across animal nervous systems. In both humans and rodents, Huwe1 is expressed throughout the adult brain with particularly strong expression in the olfactory bulb, superficial layers of the cortex, hippocampus and cerebellum (Fig. 1b) [15,16,17]. In adult C. elegans, the Huwe1 ortholog EEL-1 is expressed broadly throughout the nervous system. This includes sensory neurons, the nerve ring (a central bundle of hundreds of axons), and the motor neurons of the nerve cord (Fig. 1c) [18]. The broad expression of Huwe1 in adult mammalian and C. elegans nervous systems is consistent with Huwe1 having widespread, important roles in the nervous system, which we discuss further.","Mammalian nervous systems are composed of millions to billions of neurons. Waves of cell proliferation in various regions of the developing brain are critical to achieve these large numbers. Two particularly important regions for brain growth are the ventricular zone (VZ) of the neocortex (Fig. 2a) and the external granule layer (EGL) of the cerebellum (Fig. 2b). Proliferation of neural stem cells and neural progenitors takes place in deep layers of the neocortex. As precursors differentiate into neurons they migrate to the cortical plate (CP). In the cerebellum, proliferation of neural progenitors occurs in the superficial EGL and differentiating neurons migrate deeper to the internal granule layer (IGL). Interestingly, Huwe1 expression is lowest in regions where proliferation of neural stems cells and progenitors occurs and expression gradually increases away from these regions where neurons are differentiating and migrating [15]. Consistent with these expression patterns, both cell-based and in vivo approaches have shown that Huwe1 plays prominent roles in early development of the nervous system.
Fig. 2HUWE1 regulates neural development. (a and b) Shown to the left are diagrams of sagittal section of mouse brain. Boxes indicate a portion of (a) cerebral cortex and (b) cerebellar cortex. Center is a schematic of Huwe1 expression in neural progenitors that are proliferating, differentiating and migrating during development in (a) cerebral cortex and (b) cerebellar cortex (white = low expression, black = high expression). To the right are molecular pathways Huwe1 regulates to affect progenitor development in (a) cerebral cortex and (b) cerebellar cortex. Note that in the cerebellum Huwe1 potentially affects two pathways in different GNP populations. c Shown is a schematic of Q neuroblast migration in C. elegans which is mediated by Wnt signaling. To the left is the molecular mechanism by which EEL-1 and HUWE1 influence Wnt signaling in neuroblast migration and mammalian cell-based assaysFull size imageThe first cell-based experiments focused on differentiation of cultured embryonic stem (ES) cells into a neuronal lineage [15]. Both germline and conditional knock out of Huwe1 impaired ES cell differentiation. In cultured mouse brain slice, Huwe1 knockdown and knockout increased proliferation of cortical progenitors and reduced differentiation to neurons [15]. A subsequent in vivo study conditionally deleted the Huwe1 ubiquitin ligase domain broadly in neurons [19]. Huwe1 conditional knockouts (cKO) displayed neonatal lethality within 24 h of birth. Increased numbers of neural progenitors were observed in the developing cortex of Huwe1 cKO animals further solidifying the concept that Huwe1 inhibits neural progenitor proliferation. Consistent with this, overexpression of Huwe1 in cultured cortical slices caused the opposite phenotype, fewer dividing cells. Huwe1 ubiquitin ligase activity also functions later in development, as Huwe1 ubiquitin ligase cKOs displayed defects in differentiation of neurons in the cortex [19]. Taken together, these studies indicate that Huwe1 ubiquitin ligase activity inhibits proliferation of neural progenitors early in development, and encourages neuronal differentiation during cortical development. These functions of Huwe1 are required for proper patterning of the cortex.Because Huwe1 cKO in neurons throughout the brain resulted in lethality [19], it was plausible Huwe1 had potential roles in nervous system development outside the cortex. This was tested when Lasorella and colleagues conditionally deleted Huwe1 ubiquitin ligase activity in granule neuron progenitors (GNPs) and radial glia of the cerebellum using the GFAP promoter to express Cre [20]. 50% of these Huwe1 cKO mice died within 4 weeks of birth. Survivors developed ataxia consistent with cerebellar dysfunction. Similar to results in cortex, cerebellar GNPs lacking Huwe1 displayed expanded proliferation resulting in increased GNP numbers, increased EGL size, and reduced numbers of mature neurons in the IGL [20]. Abnormalities in cerebellar glia were also observed.GNPs of the developing cerebellum are not a homogenous population of cells. As a result, when Huwe1 was conditionally knocked out in a subset of GNPs that expressed the Atoh1 transcription factor, GNP differentiation was impaired [21]. Proliferation of Atoh1-positive GNPs could be affected in Huwe1 cKOs, but only when proliferation was increased in culture using the mitogenic stimulant Sonic Hedge Hog (Shh). Thus, compelling evidence from cell culture, brain slice, and multiple intact developing brain regions indicates that Huwe1 ubiquitin ligase activity is critical in regulating the switch from proliferation to differentiation in neural progenitors.","Let us now comment on the mechanisms by which Huwe1 regulates neural progenitor proliferation and differentiation early in development. As noted above, knockout strategies in which the HECT ubiquitin ligase domain was conditionally deleted indicated that Huwe1 ubiquitin ligase activity is required to switch neural progenitors from a proliferative state towards differentiation in the developing nervous system. Genetic and biochemical results indicated that this occurs because Huwe1 can ubiquitinate and inhibit two transcription factors, N-Myc and Atoh1 [15, 19, 21]. Consistent with this, N-Myc and Atoh1 are expressed in proliferating neural stem cells and progenitors, are down regulated as cells differentiate and can affect neural progenitor proliferation and/or differentiation.Affinity purification proteomics with a human neuroblastoma cell line initially identified Huwe1 as an N-Myc binding protein [15]. Several further in vitro and cell-based biochemical experiments indicated that Huwe1 polyubiquitinates N-Myc resulting in degradation by the 26S proteasome. Experiments in ES cells, cultured brain slice and intact brain showed that Huwe1 inhibits N-Myc to affect proliferation and differentiation of neural stem cells and progenitors. For example, Huwe1 knockout in ES cells impairs differentiation towards neural cell fates, which is rescued by N-Myc knockdown [15]. Consistent with this, levels of the N-Myc transcriptional target Cyclin D2 are elevated when Huwe1 is impaired. Similar results in cultured brain slice indicate that increased proliferation and decreased differentiation of neural progenitors caused by Huwe1 knockdown is rescued by N-Myc knockdown [15]. In developing mouse brain, Huwe1 cKO in cortex resulted in increased neuronal progenitor proliferation that was suppressed by N-Myc knockdown [19]. In both the cortex and cerebellum, loss of Huwe1 function increased N-Myc expression, and altered the N-Myc transcriptional target Cyclin D2 [19, 20]. These results indicate that Huwe1 inhibits N-Myc to affect cortical progenitor proliferation. Effects of Huwe1 on N-Myc might also influence cerebellar progenitor proliferation, but this remains unclear.Another principle gene affected by Huwe1 inhibition of N-Myc is the Notch ligand DLL3 [19]. DLL3 was discovered as a possible downstream effector of N-Myc by transcriptomics with a large number of gliomas that had differing levels of Huwe1 expression. DLL3 was confirmed as a transcriptional target of N-Myc, as N-Myc binds the DDL3 promoter and ectopic N-Myc expression increases DLL3 levels and Notch signaling. Consistent with this, Huwe1 degradation of N-Myc influences DLL3 [19]. For example, Huwe1 cKO animals display increased DLL3 mRNA and Notch1 signaling in the brain. In cultured brain slice, Huwe1 cKO causes increased neural progenitor proliferation which is suppressed by knocking down DLL3 or N-Myc. Collectively, this is strong evidence that Huwe1 directly inhibits N-Myc thereby affecting DLL3 transcription and, ultimately, neural progenitor proliferation and differentiation in the developing cortex (Fig. 2a).In the cerebellum, Huwe1 inhibition of N-Myc might affect proliferation of GNPs that express N-Myc [20], but this remains untested. A subset of cerebellar GNPs express the Atoh1 transcription factor. Huwe1 ubiquitinates and degrades Atoh1, and robustly affects development of GNPs that express this transcription factor [21]. This discovery initially stemmed from affinity purification proteomics using HEK 293 cells, which identified Huwe1 as an Atoh1 binding protein. Cell-based experiments showed that Huwe1 knockdown and overexpression affect Atoh1 ubiquitination and stability. Further supporting these findings, Huwe1 cKO resulted in increased Atoh1 protein levels in GNPs in culture and in vivo.Overexpression of Atoh1 in cultured, purified GNPs impairs differentiation, but does not affect progenitor proliferation [22]. Consistent with Huwe1 being a negative regulator of Atoh1, Huwe1 cKOs where the Atoh1 promoter was used to drive Cre expression mimicked Atoh1 overexpression phenotypes with decreased differentiation of cultured GNPs, but no effect on GNP proliferation [21]. In cultured cerebellar brain slice, Huwe1 knockdown results in impaired differentiation of GNPs. This effect was strongly suppressed when Huwe1 and Atoh1 were simultaneously knocked down [21]. Further experiments evaluating GNP differentiation in vivo using conditional knockout alleles for both Huwe1 and Atoh1 will be valuable in further evaluating this genetic relationship. Nonetheless, existing results with knockdown approaches taken together with extensive, high-quality biochemical studies support the conclusion that Huwe1 ubiquitinates and inhibits Atoh1 to affect differentiation of a subset of GNPs in the cerebellum.Interestingly, Huwe1 can inhibit proliferation of GNPs expressing Atoh1, but this only occurs when GNPs are deprived of and re-treated with Shh to stimulate proliferation [21]. This likely occurs because Shh signaling through PP2A affects dephosphorylation of Atoh1 at two serine residues. Atoh1 dephosphorylation then prevents Huwe1 ubiquitination and degradation. Thus, Huwe1 and Shh-PP2A signaling display differing effects on Atoh1 stability, which influences proliferation of Atoh1 expressing GNPs (Fig. 2b).Work on cochlear development also found that Huwe1 ubiquitinates and inhibits Atoh1 to regulate hair cell differentiation [23]. This independent study reproduced proteomic and biochemical findings to confirm that Huwe1 binds and ubiquitinates Atoh1. Interestingly, Casein Kinase 1 (CK1) phosphorylation of Atoh1 affected ubiquitination by Huwe1. This provides further evidence that phosphorylation of Atoh1 affects Huwe1-mediated degradation, and demonstrates that Huwe1 inhibits Atoh1 to affect cellular differentiation in multiple cell types.In summary, Huwe1 restricts genetic programs required to switch from proliferation to differentiation in multiple types of neural progenitors. This occurs by Huwe1 ubiquitin ligase activity triggering proteasomal degradation and inhibition of the N-Myc and Atoh1 transcription factors. This compelling body of work on Huwe1 in early nervous system development has several future research directions poised to be particularly fruitful. 1) Determining how Huwe1 is regulated in the nervous system. 2) Identifying Huwe1 binding proteins that are not ubiquitination substrates, but potentially function with this enormous molecule. 3) Evaluating if further Huwe1 ubiquitination substrates, that are novel or previously identified in cell-based studies, have functional relevance in early nervous system development.There is one final point regarding nervous system disease that is worth making here. Genetic programs involved in early development of the nervous system are often hijacked in brain cancers. Indeed, genetic changes in HUWE1 are implicated in patients with glioblastoma and medulloblastoma [19, 21]. Whether HUWE1 is involved in neuroblastoma remains unknown. These intriguing initial links to cancer now encourage further research aimed at exploring how broadly and frequently HUWE1 mutations occur in different brain cancers."
