,title,Background,Methods,Results,Conclusion
1,Approaches for establishing the function of regulatory genetic variants involved in disease,"Regulatory genetic variation is important in human disease. The application of genome-wide association studies (GWAS) to common multifactorial human traits has revealed that most associations arise in non-coding DNA and implicate regulatory variants that modulate gene expression [1]. Gene expression occurs in a dynamic functional epigenomic landscape in which the majority of genomic sequence is proposed to have regulatory potential [2]. Inter-individual variation in gene expression has been found to be heritable and can be mapped as quantitative trait loci (QTLs) [3],[4]. Such mapping studies reveal that genetic associations with gene expression are common, that they often have large effect sizes, and that regulatory variants act locally and at a distance to modulate a range of regulatory epigenetic processes, often in a highly context-specific manner [5]. Indeed, the mode of action of such regulatory variants is very diverse, reflecting the complexity of mechanisms regulating gene expression and their modulation by environmental factors at the cell, tissue or whole-organism level.Identifying regulatory variants and establishing their function is of significant current research interest as we seek to use GWAS for drug discovery and clinical benefit [6],[7]. GWAS have identified pathways and molecules that were not previously thought to be involved in disease processes and that are potential therapeutic targets [8],[9]. However, for the majority of associations, the identity of the genes involved and their mechanism of action remain unknown, which limits the utility of GWAS. An integrated approach is needed, taking advantage of new genomic tools to understand the chromatin landscape, interactions and allele-specific events, and reveal detailed molecular mechanisms.Here I review approaches to understanding regulatory variation, from the viewpoint of both researchers needing to identify and establish the function of variants underlying a particular disease association, and those seeking to define the extent of regulatory variants and their mechanism of action at a genome-wide scale. I describe the importance of understanding context-specificity in resolving regulatory variants, including defining the disease-relevant epigenomic landscape in which variants operate, to enable functional annotation. I highlight the utility of eQTL studies for linking variants with altered expression of genes and the experimental approaches for establishing function, including descriptions of recent techniques that can help. I provide a strategic view, illustrated by examples from human disease, that is relevant to variants occurring at any genomic location, whether in classical enhancer elements or other locations where there is the potential to modulate gene regulation.","Regulatory variation most commonly involves single-nucleotide variants (SNVs) but also encompasses a range of larger structural genomic variants that can affect gene expression, including copy number variation [10]. Gene regulation is a dynamic, combinatorial process involving a variety of elements and mechanisms that may only operate in particular cell types, at a given stage in development or in response to environmental factors [11],[12]. Various events that are critical to gene expression are modulated by genetic variation: transcription factor binding affinity at enhancer or promoter elements; disruption of chromatin interactions; the action of microRNAs or chromatin regulators; alternative splicing; and post-translational modifications [13],[14]. Classical epigenetic marks such as DNA methylation, chromatin state or accessibility can be modulated directly or indirectly by variants [15]-[18]. Changes in transcription factor binding related to sequence variants are thought to be a principal driver of changes in histone modifications, enhancer choice and gene expression [17]-[19].Functional variants can occur at both genic and intergenic sites, with consequences that include both up- and down-regulation of expression, differences in the kinetics of response or altered specificity. The effect of regulatory variants depends on the sequences that they modulate (for example, promoter or enhancer elements, or encoded regulatory RNAs) and the functional regulatory epigenomic landscape in which they occur. This makes regulatory variants particularly challenging to resolve, as this landscape is typically dynamic and context specific. Defining which sequences are modulated by variants has been facilitated by several approaches: analysis of signatures of evolutionary selection and sequence conservation; experimental identification of regulatory elements; and epigenomic profiling in model organisms, and more recently in humans, for diverse cell and tissue types and conditions [15],[20].The understanding of the consequences of genetic variation for gene expression provides a more tractable intermediate molecular phenotype than a whole-organism phenotype, where confounding by other factors increases heterogeneity. This more direct relationship with underlying genetic diversity might account in part for the success of approaches resolving association with transcription of sequence variants, such as eQTL mapping [3],[5].","The heritable contribution to common polygenic disease remains challenging to resolve, but GWAS have now mapped many loci with high statistical confidence. Over 90% of trait-associated variants are found to be located in non-coding DNA, and they are significantly enriched in chromatin regulatory features, notably DNase I hypersensitive sites [21]. Moreover, there is significant overrepresentation of GWAS variants in eQTL studies, implicating regulatory variants in a broad spectrum of common diseases [7].Several studies have identified functional variants involving enhancer elements and altered transcription factor binding. These include a GWAS variant associated with renal cell carcinoma that results in impaired binding and function of hypoxia inducible factor at a novel enhancer of CCND1[22]; a common variant associated with fetal hemoglobin levels in an erythroid-specific enhancer [23]; and germline variants associated with prostate and colorectal cancer that modulate transcription factor binding at enhancer elements involving looping and long-range interactions with SOX9[24] and MYC[25], respectively. Multiple variants in strong linkage disequilibrium (LD) identified by GWAS can exert functional effects through various different enhancers, resulting in cooperative effects on gene expression [26].Functional variants in promoters have also been identified that are associated with disease. These include the extreme situation in which a gain-of-function regulatory SNV created a new promoter-like element that recruits GATA1 and interferes with expression of downstream α-globin-like genes, resulting in α-thalassemia [27]. Other examples include a Crohn's-disease-associated variant in the 3' untranslated region of IRGM that alters binding by the microRNA mir-196, enhancing mRNA transcript stability and altering the efficacy of autophagy, thus affecting the anti-bacterial activity of intestinal epithelial cells [28]. Some SNVs show significant association with differences in alternative splicing [29], which may be important for disease, as illustrated by a variant of TNFRSF1A associated with multiple sclerosis, which encodes a novel form of TNFR1 that can block tumor necrosis factor [30]. Disease-associated SNVs can also modulate DNA methylation resulting in gene silencing, as illustrated by a variant in a CpG island associated with increased methylation of the HNF1B promoter [31].To identify functional variants, fine mapping of GWAS signals is vital. This can be achieved by using large sample sizes, incorporating imputation or sequence-level information, and involving diverse populations to maximize statistical confidence and resolve LD structure. Interrogation of available functional genomic datasets to enable functional annotation of identified variants and association with genes based on eQTL mapping is an important early step in prioritization and hypothesis generation. However, such analysis must take note of what is known of the pathophysiology of the disease, because the most appropriate cell or tissue type needs to be considered given the context-specificity of gene regulation and functional variants. Two case studies (Box 1) illustrate many of the different approaches that can be used to investigate the role of regulatory variants in loci identified by GWAS. These provide context for a more detailed discussion of techniques and approaches in the remainder of this review.","This section describes approaches and tools for functional annotation of variants, considering in particular the usefulness of resolving the context-specific regulatory epigenomic landscape and of mapping gene expression as a quantitative trait of transcription, protein or metabolites.Functional annotation and the regulatory epigenomic landscapeHigh-resolution epigenomic profiling at genome-wide scale using high-throughput sequencing (HTS) has enabled annotation of the regulatory landscape in which genetic variants are found and may act. This includes mapping regulatory features based on:

chromatin accessibility using DNase I hypersensitivity (DNase-seq) mapping [32],[33] and post-translational histone modifications by chromatin immunoprecipitation combined with HTS (ChIP-seq) [34] that indicate the location of regulatory elements such as enhancers;


chromatin conformation capture (3C), which can be scaled using HTS to enable mapping of genome-wide interactions for all loci (Hi-C) [35] or for selected target regions (Capture-C) [36];
targeted arrays or genome-wide HTS to define differential DNA methylation [15]; the non-coding transcriptome using RNA-seq to resolve short and long non-coding RNAs with diverse roles in gene regulation [37] that may be modulated by underlying genetic variation with consequences for common disease [38].


The ENCyclopedia Of DNA Elements (ENCODE) Project [2] has generated epigenomic maps for diverse human cell and tissue types, including chromatin state, transcriptional regulator binding and RNA transcripts, that have helped to identify and interpret functional DNA elements [20] and regulatory variants [1],[39]. Enhancers, promoters, silencers, insulators and other regulatory elements can be context specific; this means that generating datasets for particular cellular states and conditions of activation of pathophysiological relevance will be necessary if we are to use such data to inform our understanding of disease. There is also a need to increase the amount of data generated from primary cells given the caveats inherent to immortalized or cancer cell lines. For example, although studies in lymphoblastoid cell lines (LCLs) have been highly informative [40], their immortalization using the Epstein-Barr virus may alter epigenetic regulation or specific human genes, notably DNA methylation, and observed levels of gene expression, affecting the interpretation of the effects of variants [41],[42]. As part of ongoing efforts to expand the diversity of primary cell types and tissues for which epigenomic maps are available, the International Human Epigenome Consortium, which includes the NIH Roadmap Epigenetics Project [43] and BLUEPRINT [44], seeks to establish 1,000 reference epigenomes for diverse human cell types.The FANTOM5 project (for `functional annotation of the mammalian genome 5') has recently published work complementing and extending ENCODE by using cap analysis of gene expression (CAGE) and single-molecule sequencing to define comprehensive atlases of transcripts, transcription factors, promoters, enhancers and transcriptional regulatory networks [45],[46]. This includes high-resolution context-specific maps of transcriptional start sites and their usage for 432 different primary cell types, 135 tissues and 241 cell lines, enabling promoter-level characterization of gene expression [46]. The enhancer atlas generated by FANTOM5 defines a map of active enhancers that are transcribed in vivo in diverse cell types and tissues [45]. It builds on the recognition that enhancers can initiate RNA polymerase II transcription to produce eRNAs (short, unspliced, nuclear non-polyadenylated non-coding RNAs) and act to regulate context-specific expression of protein-coding genes [45]. Enhancers defined by FANTOM5 were enriched for GWAS variants; the context specificity is exemplified by the fact that GWAS variants for Graves' disease were enriched predominantly in enhancers expressed in thyroid tissue [45].Publicly accessible data available through genome browsers significantly enhances the utility to investigators of ENCODE, FANTOM5 and other datasets that allow functional annotation and interpretation of regulatory variants, while tools integrating datasets in a searchable format further enable hypothesis generation and identification of putative regulatory variants (Table 1) [39],[47],[48]. The UCSC Genome Browser, for example, includes a Variant Annotation Integrator [49], and the Ensembl genome browser includes the Ensembl Variant Effect Predictor [50]. The searchable RegulomeDB database enables annotations for particular variants to be accessed. RegulomeDB combines data from ENCODE and other datasets, including manually curated genomic regions for which there is experimental evidence of functionality; chromatin state data; ChIP-seq data for regulatory factors; eQTL data; and computational prediction of transcription factor binding and motif disruption by variants [39]. Kircher and colleagues [47] recently published a Combined Annotation-Dependent Depletion method involving 63 types of genomic annotation to establish genome-wide likelihoods of deleteriousness for SNVs and small insertion-deletions (indels), which helps to prioritize functional variants.Table 1 
                          Examples of online data resources and tools for analysis of putative regulatory variants
Full size table
Determining which variants are located in regulatory regions is further helped by analysis of conservation of DNA sequences across species (phylogenetic conservation) to define functional elements. Lunter and colleagues [51] recently reported that 8.2% of the human genome is subject to negative selection and is likely to be functional. Claussnitzer and colleagues [52] studied conservation of transcription factor binding sites in cis-regulatory modules. They found that the regulation involving such sequences was combinatorial and depended on complex patterns of co-occurring binding sites [52]. Application of their `phylogenic module complexity analysis' approach to type 2 diabetes GWAS loci revealed a functional variant in the PPARG gene locus that altered binding of the homeodomain transcription factor PRRX1. This was experimentally validated using allele-specific approaches and effects on lipid metabolism and glucose homeostasis were demonstrated.Insights from transcriptome, proteome, and metabolome QTLsMapping gene expression as a quantitative trait is a powerful way to define the regions and markers associated with differential expression between individuals [53]. Application in human populations has enabled insights into the genomic landscape of regulatory variants, generating maps that are useful for GWAS, sequencing studies and other settings where the function of genetic variants is sought [5],[7],[54]. Local variants are likely to be cis-acting and those at a distance are likely to be trans-acting. Resolution of trans-eQTLs is challenging, requiring large sample sizes owing to the number of comparisons performed, because all genotyped variants in the genome can be considered for association. However, this resolution is important given how informative eQTLs can be for defining networks, pathways and disease mechanism [55]. When combined with cis-eQTL mapping, trans-eQTL analysis allows discovery of previously unappreciated relationships between genes, as a variant showing local cis association with expression of a gene might also be found to show trans association with one or more other genes (Figure 1). For example, in the case of a cis-eQTL involving a transcription factor gene, these trans-associated genes might be regulated by that transcription factor (Figure 1c). This can be very informative when investigating loci found in GWAS; for example, a cis-eQTL for the transcription factor KLF14 that is also associated with type 2 diabetes and high-density lipoprotein cholesterol was found to act as a master trans regulator of adipose gene expression [56]. Trans-eQTL analysis is also a complementary method to ChIP-seq for defining transcription factor target genes [57]. For other cis-eQTLs, the trans-associated genes might be part of a signaling cascade (Figure 1d), which might be well annotated (for example a cis-eQTL involving IFNB1 is associated in trans with a downstream cytokine network) or provide new biological insights [57].Figure 1
Examples of local and distant effects of regulatory variants. (a) A local cis-acting variant (red star, top) in a regulatory element (red line) affects allele-specific transcription factor binding affinity and is associated with differential expression of gene A (as shown by the chart, bottom), with possession of a copy of the A allele associated with higher expression than the G allele (hence AA homozygotes having higher expression than AG heterozygotes, with lowest expression in GG homozygotes). (b) The same variant can modulate expression of gene D at a distance through DNA looping that brings the regulatory enhancer element close to the promoter of gene D (gray line) on the same chromosome. (c) An example of a local cis-acting variant modulating expression of a transcription factor encoding gene, Gene E, differential expression of which modulates a set of target genes. Expression of these target genes is found to be associated in trans with the variant upstream of gene E. (d) A local cis-acting variant on chromosome 12 modulates expression of a cytokine gene and is also associated in trans with a set of genes whose expression is regulated through a signaling cascade determined by that cytokine. Such trans associations can be shown on a circos plot (chromosomes labeled 1-22 with arrows pointing to location of gene on a given chromosome).Full size image
eQTLs are typically context specific, dependent for example on cell type [58]-[60] and state of cellular activation [57],[61],[62]. Careful consideration of relevant cell types and conditions is therefore needed when investigating regulatory variants for particular disease states. For example, eQTL analysis of the innate immune response transcriptome in monocytes defined associations involving canonical signaling pathways, key components of the inflammasome, downstream cytokines and receptors [57]. In many cases these were disease-associated variants and were identified only in induced monocytes, generating hypotheses for the mechanism of action of reported GWAS variants. Such variants would not have been resolved if only resting cells had been analyzed [57]. Other factors can also be significant modulators of observed eQTLs, including age, gender, population, geography and infection status, and they can provide important insights into gene-environment interactions [62]-[66].The majority of published eQTL studies have quantified gene expression using microarrays. Application of RNA-seq enables high-resolution eQTL mapping, including association with abundance of alternatively spliced transcripts and quantification of allele-specific expression [40],[67]. The latter provides a complementary mapping approach to define regulatory variants.In theory, eQTLs defined at the transcript level might not be reflected at the protein level. However, recent work by Kruglyak and colleagues [68] in large, highly variable yeast populations using green fluorescent protein tags to quantify single-cell protein abundance has shown good correspondence between QTLs influencing mRNA and protein abundance; genomic hotspots were associated with variation in abundance of multiple proteins and modulating networks.Mapping protein abundance as a quantitative trait (pQTL mapping) is important in ongoing efforts to understand regulatory variants and the functional follow-up of GWAS. However, a major limitation has been availability of appropriate high-throughput methods for quantification. A highly multiplexed proteomic platform involving modified aptamers was used to map cis-regulated protein expression in plasma [69], and micro-western and reverse-phase protein arrays enabled 414 proteins to be assayed simultaneously in LCLs, resolving a pQTL involved in the response to chemotherapeutic agents [70]. The application of state-of-the-art mass spectrometry-based proteomic methods is enabling quantification of protein abundance for pQTL mapping. There are still limitations, however, in the extent, sensitivity and dynamic range that can be assayed, the availability of analysis tools, and challenges inherent in studying the highly complex and diverse human proteome [71].There are multiple ways in which genetic variation can modulate the nature, abundance and function of proteins, including effects of non-coding variants on transcription, regulation of translation and RNA editing, and alternative splicing. In coding sequences, non-synonymous variants can also affect regulation of splicing and transcript stability. An estimated 15% of codons have been proposed by Stergachis and colleagues [72] to specify both amino acids and transcription factor binding sites; they found evidence that the latter resulted in codon constraint through evolutionary selective pressure, and that coding SNVs directly affected the resultant transcription factor binding. It remains unclear to what extent sequence variants modulate functionally critical post-translational modifications, such as phosphorylation, glycosylation and sulfation.The role of genetic variation in modulating human blood metabolites was highlighted by a recent large study by Shin and colleagues [73] of 7,824 individuals, in which 529 metabolites in plasma or serum were quantified using liquid-phase chromatography, gas chromatography and tandem mass spectrometry. This identified genome-wide associations at 145 loci. For specific genes, there was evidence of a spectrum of genetic variants ranging from very rare loss-of-function alleles leading to metabolic disorders to common variants associated with molecular intermediate traits and disease. Availability of eQTL data through gene expression profiling at the same time as metabolomic measurements enabled a Mendelian randomization analysis (a method for assessing causal associations in observational data that are based on the random assortment of genes from parents to offspring [74]) to search for a causal relationship between differential expression of a gene and metabolite levels using genetic variation as an instrumental variable. There were limitations due to study power but a causal role for some eQTLs in metabolic trait associations was defined, including for the acyl-CoA thioesterase THEM4 and the cytochrome P450 CYP3A5 genes [73].Finally, analysis of epigenetic phenotypes as quantitative traits has proved very informative. Degner and colleagues [16] analyzed DNase-I hypersensitivity as a quantitative trait (dsQTLs) in LCLs. Many of the observed dsQTLs were found to overlap with known functional regions, show allele-specific transcription factor binding and also show evidence of being eQTLs. Methylation QTL (meQTL) studies have also been published for a variety of cell and tissue types that provide further insight in regulatory functions of genomic variants [75]-[77]. A meQTL study in LCLs revealed significant overlap with other epigenetic marks, including histone modifications and DNase-I hypersensitivity, and also with up- and down-regulation of gene expression [77]. Altered transcription factor binding by variants was found to be a key early step in the regulatory cascade that may result in altered methylation and other epigenetic phenomena [77]."
