,title,Background,Methods,Results,Conclusion
0,Search for genetic variants in the p66Shc longevity gene by PCR-single strand conformational polymorphism in patients with early-onset cardiovascular disease,"Increasing evidence indicates that reactive oxygen species (ROS) may participate in the pathogenesis of various diseases, including cardiovascular disorders. Support to this comes from the experimental demonstration that vessel walls of patients with atherosclerotic risk factors are characterized by a significant increase in vascular ROS production [1].It has been reported that the p66Shc longevity gene increases intracellular reactive oxygen species (ROS), thereby affecting the rate of oxidative damage to nucleic acids [2]. The human Shc locus (Src homologous and collagen) encodes three proteins with relative molecular masses of 46K (p46Shc), 52K (p52Shc) and 66K (p66Shc). All three proteins share a Src-homology2 (SH2) domain, a collagen-homology (CH1) region and a phosphotyrosine-binding (PTB) domain. The p66Shc protein contains a unique amino terminal region (CH2) [3]. p46Shc, p52Shc and p66Shc are adaptor proteins in the insulin-signalling pathway, but their downstream effects differ: p46Shc and p52Shc are tyrosine-phosphorylated by a variety of growth factors, and are associated with MAPK signalling; p66Shc also undergoes tyrosine phosphorylation in response to extracellular signals but is involved in signal transduction pathways that inhibits the activation of c-fos promoter [4]. C-fos is transcriptionally activated in response to environmental stresses such as ultraviolet light (UV) or H2O2. Thus, there is in vitro evidence that p66Shc is part of a complex transduction pathway that controls oxidative stress [4].Knock out mice for the p66Shc gene locus show a higher resistance to oxidative stress and extended life span (up to 30%) [3]. Moreover, p66Shc-/- cells show a reduced oxidative stress-induced apoptosis, which is restored by p66Shc over expression [3].Also, the role of p66Shc in muscle damage that follows acute hindlimb ischemia has been investigated. Results showed that p66Shc-/- mice were resistant to tissue damage induced by ischemia and ischemia/reperfusion secondary to ROS generation, demonstrating that p66Shc plays a crucial role in the cell death pathways activated by acute ischemia [5].Further studies using p66Shc-/- mice showed a significant reduction of systemic oxidative stress, plasma LDL oxidation and early atherosclerotic lesions when mice were fed a high-fat diet [6].p66Shc expression is tissue specific [7] and it is regulated by epigenetic modifications, namely histone deacetylation and cytosine methylation. In this regard, it has been reported that histone deacetylase inhibitors and demethylating agents restore p66Shc expression in human peripheral blood lymphocytes (PBL) that normally do not express this isoform [8].More recent studies have observed that absence of p66Shc expression might contribute to the protection of the heart from the deleterious effects of elevated Angiotensis II levels [9]. Furthermore, it was reported that inactivation of the p66Shc gene protects against age-dependent ROS-mediated endothelial dysfunction [10] in p66Shc KO mice.It appears therefore that p66Shc may play a pivotal role in controlling oxidative stress and vascular dysfunction in vivo, possibly regulating the evolution of the atherosclerotic process. Based on this background, we investigated the p66Shc specific region of the Shc gene and its upstream promoter for variations in a selected group of subjects with early-onset coronary artery disease (CAD).","The possible effect of p66Shc longevity gene mutations on CAD would probably determine an early onset of the disease, and assuming that a genetic effect might be more evident in younger patients, we choose to select subjects with age of diagnosis of CAD <55 years. This age limit was based on the incidence curves of CAD and the estimates of genetic effect at various ages [11, 12]. As controls we studied 93 unrelated long-living subjects (mean age 89 ± 6 years) randomly selected from a population of individuals screened for CAD risk factors.The human Shc locus encodes three proteins (p46, p52 and p66) by using two alternative promoters that synthesize two mRNAs coding for p46/p52 and for p66 [8]. The p66Shc promoter, positioned in the first intron of the Shc locus, contains a relative high frequency of CpG dinucleotides whose methylation regulates the transcriptional activity of p66Shc promoter [8]. Considering the recent observations that alterations in expression of p66Shc gene might be one possible cause in determining life span and in controlling oxidative stress, we hypothesised that sequence variations in p66Shc promoter may contribute to both aging and early atherogenesis. PCR-SSCP analysis of the p66 specific region of the Shc locus and the p66Shc promoter (from nucleotide -637) revealed two variant bands (Figure 1). Sequencing of these variants showed two SNPs: -354T>C in the regulatory region of p66Shc locus and 92C>T in the p66 specific region (CH2). The first substitution partially modifies the binding consensus sequence of the Sp1 transcription factor, and was detected only in two heterozygous carriers (1 CAD subject and 1 control subject). The 92C>T substitution in the CH2 region consists in an amino acid substitution at codon 31 in which proline is substituted with leucine (P31L), and was detected in heterozygous status only in one CAD subject. No subjects homozygous for the two newly described SNPs were found. One family member of the subject carrying the P31L mutation, also affected by early-onset CAD (the brother, age 37 years), was screened for these new polymorphisms, but no SNPs were detected.Figure 1Mutation detection with SSCP and sequence electropherograms of p66Shc. PCR-SSCP and sequence analysis of the regulatory region of p66Shc locus (A) and of the p66Shc specific region CH2 (B). In the sequence electropherograms, arrows indicate the nucleotide substitution in heterozygous subjects as shown by the presence of the 2 superimposed peaks representing the normal and abnormal base. A) SSCP analysis of the 5' regulatory region of p66 locus (T/T subjects with wild-type sequence, T/C subjects heterozygous for the variant). B) SSCP analysis of the CH2 region: the 92C>T substitution consisted in an amino acid substitution P31L (C/C subjects with wild-type sequence, C/T subject heterozygous for the variant).Full size image","We screened for new DNA polymorphisms the p66 specific region of the Shc locus (CH2) and the p66Shc promoter. We identified by PCR-SSCP assay of 1167 base pairs in 4 amplified segments two segregating sites in 2 out of the 342 chromosomes examined. The two novel variants (-354T>C and 92C>T) were very rare in both populations of CAD and elderly subjects. Furthermore, no subject homozygous for the two SNPs was found.Our observations agree with a previous study performed in a sample of extreme survivors of the Leiden 85-plus Study, where no sequence variations in the p66 specific region of the Shc gene were found [13].The Shc gene contains one known non-synonymous polymorphism located in the CH1 domain which corresponds to Met300Val in the p52 isoform and to Met410Val in the p66 isoform [13]. No association of the Met300Val (the p52 isoform) variation was found with birth weight and length, impaired insulin secretion, insulin resistance and type 2 Diabetes Mellitus in a cohort of 360 young healthy Danish Caucasian subjects [14]. In a more recent study the Met410Val variant (the p66 isoform) was tested for association with longevity using a prospective follow-up design in two independent cohorts of 730 and 563 subjects aged 85 and over [13]. Mooijaart and co-workers observed a small increase in Val allele with increasing age of death and a decreased mortality risk of Met/Val carriers compared to Met/Met carriers; however no statistical significance was reached in the two different analyses [13]. These results suggest a possible beneficial effect of the Valine allele on longevity, but no subject homozygous for valine was found and the frequency of this allele was very low in this cohort. To date, no functional studies on the Met/Val variant of the p66Shc isoform have been performed.Finally, this Met/Val amino acid variant is present in all 3 isoform of the Shc gene, thus suggesting that this polymorphism is unlikely to specifically affect the function of p66Shc and not of p46Shc and p52Shc. For all these reasons we did not study the Met/Val variant in our cohorts, since we were looking for variants that would affect particularly the p66Shc gene.","Longevity is a complex trait, resulting from the interaction between multiple genetic and environmental factors. Before our, several studies in long-lived subjects have highlighted the role of biological factors as determinant of 'successful ageing'. For example associations between successful ageing and paraoxonase 1 (PON1) and interleukin 10 (IL-10) gene polymorphisms have been reported in centenarian [15–17]. However, confirmatory data is needed, and probably several other genetic factors are involved.In our study we had hypothesised that the p66Shc gene may play a pivotal role in controlling oxidative stress and vascular dysfunction in vivo, possibly regulating the evolution of the atherosclerotic process. In view of its association with CAD in animal models, we assumed that sequence variations would be less frequent in elderly survivors compared to younger CAD subjects.We screened for new DNA polymorphisms the p66 specific region of the Shc locus (CH2) and the p66Shc promoter and identified two very rare novel variants with no subject homozygous for these SNPs.Our observations agree with a previous study where no sequence variations in the p66 specific region of the Shc gene were found [13]. In the rest of the Shc gene, only one nucleotide substitution (Met/Val) has been reported, located in the CH1 domain and common to all three isoforms of the Shc gene [13, 14]. These observations, together with our data, suggest that important variations in the Shc gene may not be tolerated and that evolution might have selected against their occurrence, and it appears that the role of p66Shc gene in mammalian longevity is probably more complex than previously thought."
